{
  "message": "Тёплое море в ноябре — это Хургада: море 26°, воздух 28° и почти без дождей, от 112 000 ₽ на 7 ночей для 2 взрослых и ребёнка. Анталья дешевле — от 98 000 ₽, но море уже 22°. Дубай теплее всех, но и дороже: от 156 000 ₽. Сочи самый близкий, хотя купаться в 16° — на любителя 🙂 Считал вылет из Москвы — поправьте чипом, если не так. И подскажите, сколько лет ребёнку: от этого зависят цены.",
  "items": [
    {
      "id": "hurghada",
      "why": "Самое тёплое море — 26°, почти без дождей, прямые рейсы.",
      "watch_out": "Лететь 5,5 ч"
    },
    {
      "id": "antalya",
      "why": "Популярное направление: близко — 4 ч лёта, и дешевле Хургады.",
      "watch_out": "Море 22° — прохладновато; 6 дождливых дней"
    },
    {
      "id": "dubai",
      "why": "Море 27°, пляжи и город в одном месте.",
      "watch_out": "Лететь 5,3 ч; дороже остальных: от 156 000 ₽"
    },
    {
      "id": "sochi",
      "why": "Ближе всего — 2,3 ч, и самый бюджетный: от 74 000 ₽.",
      "watch_out": "Море 16° — прохладновато; 9 дождливых дней"
    }
  ],
  "recommended_id": "hurghada",
  "upsell": []
}
