{
  "message": "Похоже на Бали — тропический остров и пляж. Если угадал, то Бали в ноябре — от 189 000 ₽ на 10 ночей для двоих. Если нет — вот места с тем же настроением: Пхукет от 162 000 ₽ и Нячанг от 141 000 ₽. Поставил ноябрь и двоих — поправьте чипами. Подтвердите кнопкой, Бали ли на фото.",
  "items": [
    {
      "id": "bali",
      "why": "Пляжи, тропики и остров — как на фото.",
      "watch_out": "14 дождливых дней; лететь 16,5 ч"
    },
    {
      "id": "phuket",
      "why": "Тот же тропический остров, море 28° и меньше дождей — 9 дней.",
      "watch_out": "9 дождливых дней; лететь 11 ч"
    },
    {
      "id": "nha_trang",
      "why": "Тропический пляж и самый доступный из трёх: от 141 000 ₽.",
      "watch_out": "15 дождливых дней; лететь 10 ч"
    }
  ],
  "recommended_id": "bali",
  "upsell": []
}
